{
  "schema_version": 1,
  "produced_by": "options/derive_quotes",
  "read_only": true,
  "venue": "derive",
  "deployment": "v2 \u00b7 Derive Chain (production)",
  "endpoint": "wss://api.lyra.finance/ws",
  "asset": "ETH",
  "fetched_at": "2026-09-26T13:54:10.145003Z",
  "spot": {
    "value": 2684.815,
    "source": "ETH-PERP mid"
  },
  "policy_inputs": {
    "min_tenor_days": 180,
    "strike_otm_pct": 10.0,
    "max_premium_bps": 1200
  },
  "selected": null,
  "ladder": [
    {
      "instrument": "ETH-20270326-1400-P",
      "kind": "P",
      "expiry": "2027-03-26",
      "tenor_days": 180.8,
      "strike": 1400.0,
      "bid": null,
      "bid_size": 0.0,
      "ask": null,
      "ask_size": 0.0
    },
    {
      "instrument": "ETH-20270326-1500-P",
      "kind": "P",
      "expiry": "2027-03-26",
      "tenor_days": 180.8,
      "strike": 1500.0,
      "bid": null,
      "bid_size": 0.0,
      "ask": null,
      "ask_size": 0.0
    },
    {
      "instrument": "ETH-20270326-1600-P",
      "kind": "P",
      "expiry": "2027-03-26",
      "tenor_days": 180.8,
      "strike": 1600.0,
      "bid": null,
      "bid_size": 0.0,
      "ask": null,
      "ask_size": 0.0
    },
    {
      "instrument": "ETH-20270326-1800-P",
      "kind": "P",
      "expiry": "2027-03-26",
      "tenor_days": 180.8,
      "strike": 1800.0,
      "bid": null,
      "bid_size": 0.0,
      "ask": 80.0,
      "ask_size": 0.5,
      "premium_bps_ask": 297.97
    },
    {
      "instrument": "ETH-20270326-1900-P",
      "kind": "P",
      "expiry": "2027-03-26",
      "tenor_days": 180.8,
      "strike": 1900.0,
      "bid": null,
      "bid_size": 0.0,
      "ask": null,
      "ask_size": 0.0
    },
    {
      "instrument": "ETH-20270326-2000-P",
      "kind": "P",
      "expiry": "2027-03-26",
      "tenor_days": 180.8,
      "strike": 2000.0,
      "bid": null,
      "bid_size": 0.0,
      "ask": 123.0,
      "ask_size": 60.0,
      "premium_bps_ask": 458.13
    },
    {
      "instrument": "ETH-20270326-2100-P",
      "kind": "P",
      "expiry": "2027-03-26",
      "tenor_days": 180.8,
      "strike": 2100.0,
      "bid": null,
      "bid_size": 0.0,
      "ask": null,
      "ask_size": 0.0
    },
    {
      "instrument": "ETH-20270326-2200-P",
      "kind": "P",
      "expiry": "2027-03-26",
      "tenor_days": 180.8,
      "strike": 2200.0,
      "bid": null,
      "bid_size": 0.0,
      "ask": null,
      "ask_size": 0.0
    },
    {
      "instrument": "ETH-20270326-2300-P",
      "kind": "P",
      "expiry": "2027-03-26",
      "tenor_days": 180.8,
      "strike": 2300.0,
      "bid": null,
      "bid_size": 0.0,
      "ask": null,
      "ask_size": 0.0
    },
    {
      "instrument": "ETH-20270326-2400-P",
      "kind": "P",
      "expiry": "2027-03-26",
      "tenor_days": 180.8,
      "strike": 2400.0,
      "bid": null,
      "bid_size": 0.0,
      "ask": null,
      "ask_size": 0.0
    },
    {
      "instrument": "ETH-20270326-2500-P",
      "kind": "P",
      "expiry": "2027-03-26",
      "tenor_days": 180.8,
      "strike": 2500.0,
      "bid": null,
      "bid_size": 0.0,
      "ask": null,
      "ask_size": 0.0
    },
    {
      "instrument": "ETH-20270326-2600-P",
      "kind": "P",
      "expiry": "2027-03-26",
      "tenor_days": 180.8,
      "strike": 2600.0,
      "bid": null,
      "bid_size": 0.0,
      "ask": null,
      "ask_size": 0.0
    },
    {
      "instrument": "ETH-20270326-2700-P",
      "kind": "P",
      "expiry": "2027-03-26",
      "tenor_days": 180.8,
      "strike": 2700.0,
      "bid": null,
      "bid_size": 0.0,
      "ask": null,
      "ask_size": 0.0
    },
    {
      "instrument": "ETH-20270326-2800-P",
      "kind": "P",
      "expiry": "2027-03-26",
      "tenor_days": 180.8,
      "strike": 2800.0,
      "bid": null,
      "bid_size": 0.0,
      "ask": null,
      "ask_size": 0.0
    },
    {
      "instrument": "ETH-20270326-3000-P",
      "kind": "P",
      "expiry": "2027-03-26",
      "tenor_days": 180.8,
      "strike": 3000.0,
      "bid": null,
      "bid_size": 0.0,
      "ask": null,
      "ask_size": 0.0
    },
    {
      "instrument": "ETH-20270326-3200-P",
      "kind": "P",
      "expiry": "2027-03-26",
      "tenor_days": 180.8,
      "strike": 3200.0,
      "bid": null,
      "bid_size": 0.0,
      "ask": null,
      "ask_size": 0.0
    },
    {
      "instrument": "ETH-20270625-1400-P",
      "kind": "P",
      "expiry": "2027-06-25",
      "tenor_days": 271.8,
      "strike": 1400.0,
      "bid": null,
      "bid_size": 0.0,
      "ask": null,
      "ask_size": 0.0
    },
    {
      "instrument": "ETH-20270625-1500-P",
      "kind": "P",
      "expiry": "2027-06-25",
      "tenor_days": 271.8,
      "strike": 1500.0,
      "bid": null,
      "bid_size": 0.0,
      "ask": null,
      "ask_size": 0.0
    },
    {
      "instrument": "ETH-20270625-1600-P",
      "kind": "P",
      "expiry": "2027-06-25",
      "tenor_days": 271.8,
      "strike": 1600.0,
      "bid": null,
      "bid_size": 0.0,
      "ask": null,
      "ask_size": 0.0
    },
    {
      "instrument": "ETH-20270625-1800-P",
      "kind": "P",
      "expiry": "2027-06-25",
      "tenor_days": 271.8,
      "strike": 1800.0,
      "bid": null,
      "bid_size": 0.0,
      "ask": null,
      "ask_size": 0.0
    },
    {
      "instrument": "ETH-20270625-1900-P",
      "kind": "P",
      "expiry": "2027-06-25",
      "tenor_days": 271.8,
      "strike": 1900.0,
      "bid": null,
      "bid_size": 0.0,
      "ask": null,
      "ask_size": 0.0
    },
    {
      "instrument": "ETH-20270625-2000-P",
      "kind": "P",
      "expiry": "2027-06-25",
      "tenor_days": 271.8,
      "strike": 2000.0,
      "bid": null,
      "bid_size": 0.0,
      "ask": null,
      "ask_size": 0.0
    },
    {
      "instrument": "ETH-20270625-2100-P",
      "kind": "P",
      "expiry": "2027-06-25",
      "tenor_days": 271.8,
      "strike": 2100.0,
      "bid": null,
      "bid_size": 0.0,
      "ask": null,
      "ask_size": 0.0
    },
    {
      "instrument": "ETH-20270625-2200-P",
      "kind": "P",
      "expiry": "2027-06-25",
      "tenor_days": 271.8,
      "strike": 2200.0,
      "bid": null,
      "bid_size": 0.0,
      "ask": null,
      "ask_size": 0.0
    },
    {
      "instrument": "ETH-20270625-2300-P",
      "kind": "P",
      "expiry": "2027-06-25",
      "tenor_days": 271.8,
      "strike": 2300.0,
      "bid": null,
      "bid_size": 0.0,
      "ask": null,
      "ask_size": 0.0
    },
    {
      "instrument": "ETH-20270625-2400-P",
      "kind": "P",
      "expiry": "2027-06-25",
      "tenor_days": 271.8,
      "strike": 2400.0,
      "bid": null,
      "bid_size": 0.0,
      "ask": null,
      "ask_size": 0.0
    },
    {
      "instrument": "ETH-20270625-2500-P",
      "kind": "P",
      "expiry": "2027-06-25",
      "tenor_days": 271.8,
      "strike": 2500.0,
      "bid": null,
      "bid_size": 0.0,
      "ask": 345.0,
      "ask_size": 0.01,
      "premium_bps_ask": 1285.0
    },
    {
      "instrument": "ETH-20270625-2600-P",
      "kind": "P",
      "expiry": "2027-06-25",
      "tenor_days": 271.8,
      "strike": 2600.0,
      "bid": null,
      "bid_size": 0.0,
      "ask": null,
      "ask_size": 0.0
    },
    {
      "instrument": "ETH-20270625-2700-P",
      "kind": "P",
      "expiry": "2027-06-25",
      "tenor_days": 271.8,
      "strike": 2700.0,
      "bid": null,
      "bid_size": 0.0,
      "ask": null,
      "ask_size": 0.0
    },
    {
      "instrument": "ETH-20270625-2800-P",
      "kind": "P",
      "expiry": "2027-06-25",
      "tenor_days": 271.8,
      "strike": 2800.0,
      "bid": null,
      "bid_size": 0.0,
      "ask": null,
      "ask_size": 0.0
    },
    {
      "instrument": "ETH-20270625-2900-P",
      "kind": "P",
      "expiry": "2027-06-25",
      "tenor_days": 271.8,
      "strike": 2900.0,
      "bid": null,
      "bid_size": 0.0,
      "ask": null,
      "ask_size": 0.0
    },
    {
      "instrument": "ETH-20270625-3000-P",
      "kind": "P",
      "expiry": "2027-06-25",
      "tenor_days": 271.8,
      "strike": 3000.0,
      "bid": null,
      "bid_size": 0.0,
      "ask": null,
      "ask_size": 0.0
    },
    {
      "instrument": "ETH-20270625-3100-P",
      "kind": "P",
      "expiry": "2027-06-25",
      "tenor_days": 271.8,
      "strike": 3100.0,
      "bid": null,
      "bid_size": 0.0,
      "ask": null,
      "ask_size": 0.0
    },
    {
      "instrument": "ETH-20270625-3200-P",
      "kind": "P",
      "expiry": "2027-06-25",
      "tenor_days": 271.8,
      "strike": 3200.0,
      "bid": null,
      "bid_size": 0.0,
      "ask": 765.0,
      "ask_size": 0.22,
      "premium_bps_ask": 2849.36
    },
    {
      "instrument": "ETH-20270924-1400-P",
      "kind": "P",
      "expiry": "2027-09-24",
      "tenor_days": 362.8,
      "strike": 1400.0,
      "bid": null,
      "bid_size": 0.0,
      "ask": null,
      "ask_size": 0.0
    },
    {
      "instrument": "ETH-20270924-1500-P",
      "kind": "P",
      "expiry": "2027-09-24",
      "tenor_days": 362.8,
      "strike": 1500.0,
      "bid": null,
      "bid_size": 0.0,
      "ask": null,
      "ask_size": 0.0
    },
    {
      "instrument": "ETH-20270924-1600-P",
      "kind": "P",
      "expiry": "2027-09-24",
      "tenor_days": 362.8,
      "strike": 1600.0,
      "bid": null,
      "bid_size": 0.0,
      "ask": null,
      "ask_size": 0.0
    },
    {
      "instrument": "ETH-20270924-1800-P",
      "kind": "P",
      "expiry": "2027-09-24",
      "tenor_days": 362.8,
      "strike": 1800.0,
      "bid": null,
      "bid_size": 0.0,
      "ask": null,
      "ask_size": 0.0
    },
    {
      "instrument": "ETH-20270924-1900-P",
      "kind": "P",
      "expiry": "2027-09-24",
      "tenor_days": 362.8,
      "strike": 1900.0,
      "bid": null,
      "bid_size": 0.0,
      "ask": null,
      "ask_size": 0.0
    },
    {
      "instrument": "ETH-20270924-2000-P",